{
  "$schema": "https://json-schema.org/draft/2020-12/schema",
  "title": "Document Consistency Review Package",
  "type": "object", "additionalProperties": false,
  "required": ["schema_version", "package_id", "status", "normative_approval", "completeness", "commit", "artifacts", "open_requirements", "rollout_decision"],
  "properties": {
    "schema_version": {"const": "1.0.0"},
    "package_id": {"type": "string", "pattern": "^dcr-package-[0-9]{4}$"},
    "status": {"enum": ["candidate", "reviewed"]},
    "normative_approval": {"const": false},
    "completeness": {"enum": ["incomplete", "complete"]},
    "commit": {"type": "string", "pattern": "^[0-9a-f]{40}$"},
    "artifacts": {"type": "array", "minItems": 1, "items": {"type": "object", "additionalProperties": false, "required": ["role", "path", "sha256"], "properties": {"role": {"type": "string"}, "path": {"type": "string"}, "sha256": {"type": "string", "pattern": "^[0-9a-f]{64}$"}}}},
    "open_requirements": {"type": "array", "minItems": 1, "items": {"type": "string"}},
    "rollout_decision": {"const": "pending"}
  }
}
